1,Tu as tort ! Le climat c'est l’ensemble des éléments qui caractérisent l’état moyen de l’atmosphère sur une longue période d'au moins trente ans.,"Le climat c'est les conditions météorologiques d’un instant donné ou d’une courte période (une journée, une semaine, etc.).","Le climat c'est facile, c'est juste l'évolution de la température sur Terre.",Un article dit que le climat c'est un terme plus complexe pour définir la météo.,le climat c'est la méteo d'une ville
2,D'ici 2050 avec des actions gouvernementale et structurelle on pourrait réduire l'émission des gaz à effet de serre de 40%-70%,"On peut réduire l'émission des gaz à effet de serre de 2% ce qui n'est pas beaucoup, c 'est pas en arretant de prendre la voiture qu'il va y avoir une grosse difference.",Seulement 50 personnes doivent changer leurs habitudes pour réduire de 30%-60% l'émission de gaz à effet de serre ,En faisant collectivement des efforts on peut réduire jusqu'à 20% l'émission de gaz à effet de serre ,90% des émissions à effet de serre peuvent être réduit si les pays les plus développés réduisent leur consommation de 5%
3,Non ! le réchauffement devrait avoir dépassé les 2°C avec notre émission actuelle de gaz à effet de serre ,"Pas d'inquiétude, la température stagne et stagnera.",Mais non le réchauffement devrait avoir dépassé les 9°C se qui entraînerait une hausse des incendies,"Je vous dit que c'est urgent, d'ici la fin de l'année on est tous mort, +25°C!","La vérité, c'est que la température varie normalement, nous n'influons pas sur les températures à venir."
4,Tu as tort pour atténuer le gaz à effet de serre il faut planter plus d'arbres et changer son empreinte carbone ,"pour atténuer l'émission de gaz à effet de serre il suffit d'utiliser le BECCS (bioénergie, captage, et stockage du carbone",Non ! il faut utiliser un aspirateur ,Pas du tout ! il faut bombarder la terre pour expulser le CO2,Encore mieux ! on envoie du -CO2 pour annuler le CO2
5,Tu a tort les quatre dernières deccenies indiquent que la température a augmenté en moyenne de 1.1°C,Les 4 dernières decennies montrent une diminution de -3°C,Même pas vrai ! Tout le monde sait que cela n'existe pas,Pffff ! La température est seulement montée de 35°C,Je sais ! La température est descendue de -40° dans la plupart des pays 
6,L'écart de température peut aller jusqu'à 12°C entre les zones rurales et les grandes villes ,Il n'y a pas de différence de température entre la ville et les zones rurales,Le béton retrouvé en ville permet de diminuer la température comparé aux zones rurales ,Les arbres ne permettent pas de diminuer la température ,Il y a une différence allant jusqu'à 20°C dans les grandes villes comparé aux zones rurales 
7,"La baisse importante de l'émission de l'effet de serre permettrait au réchauffement climatique d'être inférieur à 2°C, réduisant ainsi la crise écologique","La baisse importante de l'émission de l'effet de serre n'influencerais pas le réchauffement climatique, empechant la fonte des glaces d'augmenter ","le réchauffement devrait diminuer de -2°C, ce qui va augmenter l'émission des gaz à effet de serre et qui fera en sorte que les glaciers se reforment ","La baisse des émissions de gaz à effet de serre aurait un impact sur le réchauffement climatique qui devrait être diminuer de 5°C, reduisant un peu l'impact écologique mais pas assez ","La baisse ponctuelle de l'émission de gaz à effet de serre permettrait d'avoir une augmentation de 3°C, reduisant un peu l'impact écologique mais pas assez "
8,Une augmentation continue de l'emission des gaz à effet de serre provoquerait d'ici 210m une augmentation de +4°C voire de +5°C,Une augmentation de l'émission des gaz à effet de serre provoquerait une augmentation de la température allant jusqu'à +10°C dans les 15 prochaines années ,le réchauffement devrait diminuer de -2°C si l'on augmente l'émission de gaz à effet de serre ,le réchauffement devrait rester constant si l'on continue à émettre autant de gaz à effet de serre ,"le réchauffement devrait augmenter de 1,5°C en continuant d'émettre autant de gaz à effet de serre "
9,la solution pour l'atténuation et l'adaptation est l'agroécologie,"Je vous dis qu’il faut arrêter de recycler, à la fin tous les déchets sont mélangés.","Au lieu de mettre la clim l'été, allumer un ventilateur.",pédaler pour faire de l'électricité ,Utiliser un maximum les énergies fossiles.
10,-2t CO2eq,L'usage de la voiture pour des voyages personnel est normal et tres ecologique car il se font sur de courte distance.,-1t CO2eq,-0t CO2eq,"-0,5t CO2eq"
